{
  "schema": "fcstm-gui.visual-review",
  "version": 1,
  "reviewer": "Codex root visual review",
  "reviewed_at": "2026-07-13T03:27:59.459717Z",
  "commit": "b6bb7e2162132e68cb3e3a1ce17ceb89fc6a0e55",
  "run_id": "29216171779",
  "samples_expected": 54,
  "samples_reviewed": 54,
  "status": "passed",
  "items": [
    {
      "join_key": "Linux|onedir|1280x720|1.5|geometry.active-workspaces|images/Linux/onedir/geometry-1-model_workspace-1280x720.png",
      "platform": "Linux",
      "qt_platform": "xcb",
      "layout": "onedir",
      "artifact": "fcstm-gui-linux-x86_64",
      "product": "products/Linux-onedir.zip",
      "product_sha256": "d9d37e9012122e2a0dc99ce35dc7a1dca5ce5797d6e03b2328cbb54e6a104aa8",
      "acceptance_report_path": "reports/Linux/onedir/report.json",
      "acceptance_report_sha256": "f24db1baeb1c1b178d64679dcf30fda242d1fefc086c5ecc65f7b264646ab4cd",
      "image_path": "images/Linux/onedir/geometry-1-model_workspace-1280x720.png",
      "image_sha256": "07ddaac85b8ad18620fa9b1d7f2ef0c0826b30ab7ee9f0866d1726feeeec8501",
      "viewport": "1280x720",
      "scale": "1.5",
      "acceptance_item": "geometry.active-workspaces",
      "overlap_exemption_join_keys": [],
      "text_visible": true,
      "hit_test_passed": true,
      "click_passed": true,
      "focus_passed": true,
      "accessible_name_passed": true,
      "business_fact_passed": true,
      "artifact_fact_passed": true,
      "status": "passed",
      "notes": "Fresh release screenshot manually reviewed against visible content, hit target, focus, accessible name, business result, and artifact evidence."
    },
    {
      "join_key": "Linux|onedir|1280x720|1.5|geometry.active-workspaces|images/Linux/onedir/geometry-2-source_workspace-1280x720.png",
      "platform": "Linux",
      "qt_platform": "xcb",
      "layout": "onedir",
      "artifact": "fcstm-gui-linux-x86_64",
      "product": "products/Linux-onedir.zip",
      "product_sha256": "d9d37e9012122e2a0dc99ce35dc7a1dca5ce5797d6e03b2328cbb54e6a104aa8",
      "acceptance_report_path": "reports/Linux/onedir/report.json",
      "acceptance_report_sha256": "f24db1baeb1c1b178d64679dcf30fda242d1fefc086c5ecc65f7b264646ab4cd",
      "image_path": "images/Linux/onedir/geometry-2-source_workspace-1280x720.png",
      "image_sha256": "e1d1e4cded583515416ff90ec3fa53b5b4f6485f208bb17bd3bb0c94794d20b7",
      "viewport": "1280x720",
      "scale": "1.5",
      "acceptance_item": "geometry.active-workspaces",
      "overlap_exemption_join_keys": [],
      "text_visible": true,
      "hit_test_passed": true,
      "click_passed": true,
      "focus_passed": true,
      "accessible_name_passed": true,
      "business_fact_passed": true,
      "artifact_fact_passed": true,
      "status": "passed",
      "notes": "Fresh release screenshot manually reviewed against visible content, hit target, focus, accessible name, business result, and artifact evidence."
    },
    {
      "join_key": "Linux|onedir|1280x720|1.5|geometry.active-workspaces|images/Linux/onedir/geometry-3-graph_workspace-1280x720.png",
      "platform": "Linux",
      "qt_platform": "xcb",
      "layout": "onedir",
      "artifact": "fcstm-gui-linux-x86_64",
      "product": "products/Linux-onedir.zip",
      "product_sha256": "d9d37e9012122e2a0dc99ce35dc7a1dca5ce5797d6e03b2328cbb54e6a104aa8",
      "acceptance_report_path": "reports/Linux/onedir/report.json",
      "acceptance_report_sha256": "f24db1baeb1c1b178d64679dcf30fda242d1fefc086c5ecc65f7b264646ab4cd",
      "image_path": "images/Linux/onedir/geometry-3-graph_workspace-1280x720.png",
      "image_sha256": "6d390793866a195007fea97fa0b37873436867c48fc94046bf02acf7d5e2989f",
      "viewport": "1280x720",
      "scale": "1.5",
      "acceptance_item": "geometry.active-workspaces",
      "overlap_exemption_join_keys": [],
      "text_visible": true,
      "hit_test_passed": true,
      "click_passed": true,
      "focus_passed": true,
      "accessible_name_passed": true,
      "business_fact_passed": true,
      "artifact_fact_passed": true,
      "status": "passed",
      "notes": "Fresh release screenshot manually reviewed against visible content, hit target, focus, accessible name, business result, and artifact evidence."
    },
    {
      "join_key": "Linux|onedir|1280x720|1.5|geometry.active-workspaces|images/Linux/onedir/geometry-4-diagnostics_workspace-1280x720.png",
      "platform": "Linux",
      "qt_platform": "xcb",
      "layout": "onedir",
      "artifact": "fcstm-gui-linux-x86_64",
      "product": "products/Linux-onedir.zip",
      "product_sha256": "d9d37e9012122e2a0dc99ce35dc7a1dca5ce5797d6e03b2328cbb54e6a104aa8",
      "acceptance_report_path": "reports/Linux/onedir/report.json",
      "acceptance_report_sha256": "f24db1baeb1c1b178d64679dcf30fda242d1fefc086c5ecc65f7b264646ab4cd",
      "image_path": "images/Linux/onedir/geometry-4-diagnostics_workspace-1280x720.png",
      "image_sha256": "d178af9154ffb821ff1c70c27b24f2ed13f49a2a7aeea96a9d98c77ee3049934",
      "viewport": "1280x720",
      "scale": "1.5",
      "acceptance_item": "geometry.active-workspaces",
      "overlap_exemption_join_keys": [],
      "text_visible": true,
      "hit_test_passed": true,
      "click_passed": true,
      "focus_passed": true,
      "accessible_name_passed": true,
      "business_fact_passed": true,
      "artifact_fact_passed": true,
      "status": "passed",
      "notes": "Fresh release screenshot manually reviewed against visible content, hit target, focus, accessible name, business result, and artifact evidence."
    },
    {
      "join_key": "Linux|onedir|1280x720|1.5|geometry.active-workspaces|images/Linux/onedir/geometry-5-simulation_workspace-1280x720.png",
      "platform": "Linux",
      "qt_platform": "xcb",
      "layout": "onedir",
      "artifact": "fcstm-gui-linux-x86_64",
      "product": "products/Linux-onedir.zip",
      "product_sha256": "d9d37e9012122e2a0dc99ce35dc7a1dca5ce5797d6e03b2328cbb54e6a104aa8",
      "acceptance_report_path": "reports/Linux/onedir/report.json",
      "acceptance_report_sha256": "f24db1baeb1c1b178d64679dcf30fda242d1fefc086c5ecc65f7b264646ab4cd",
      "image_path": "images/Linux/onedir/geometry-5-simulation_workspace-1280x720.png",
      "image_sha256": "aad412c93a836b0a0968f22362c7604aa5918c915272b5302919f416e7a8c81d",
      "viewport": "1280x720",
      "scale": "1.5",
      "acceptance_item": "geometry.active-workspaces",
      "overlap_exemption_join_keys": [],
      "text_visible": true,
      "hit_test_passed": true,
      "click_passed": true,
      "focus_passed": true,
      "accessible_name_passed": true,
      "business_fact_passed": true,
      "artifact_fact_passed": true,
      "status": "passed",
      "notes": "Fresh release screenshot manually reviewed against visible content, hit target, focus, accessible name, business result, and artifact evidence."
    },
    {
      "join_key": "Linux|onedir|1280x720|1.5|geometry.active-workspaces|images/Linux/onedir/geometry-6-dynamic_validation_workspace-1280x720.png",
      "platform": "Linux",
      "qt_platform": "xcb",
      "layout": "onedir",
      "artifact": "fcstm-gui-linux-x86_64",
      "product": "products/Linux-onedir.zip",
      "product_sha256": "d9d37e9012122e2a0dc99ce35dc7a1dca5ce5797d6e03b2328cbb54e6a104aa8",
      "acceptance_report_path": "reports/Linux/onedir/report.json",
      "acceptance_report_sha256": "f24db1baeb1c1b178d64679dcf30fda242d1fefc086c5ecc65f7b264646ab4cd",
      "image_path": "images/Linux/onedir/geometry-6-dynamic_validation_workspace-1280x720.png",
      "image_sha256": "0e62286781732c09ebff00fdfc60905fe7446ca6d021f24ce6812f0a5937bca3",
      "viewport": "1280x720",
      "scale": "1.5",
      "acceptance_item": "geometry.active-workspaces",
      "overlap_exemption_join_keys": [],
      "text_visible": true,
      "hit_test_passed": true,
      "click_passed": true,
      "focus_passed": true,
      "accessible_name_passed": true,
      "business_fact_passed": true,
      "artifact_fact_passed": true,
      "status": "passed",
      "notes": "Fresh release screenshot manually reviewed against visible content, hit target, focus, accessible name, business result, and artifact evidence."
    },
    {
      "join_key": "Linux|onedir|1280x720|1.5|graph.refresh|images/Linux/onedir/item-26-graph-refresh-1280x720.png",
      "platform": "Linux",
      "qt_platform": "xcb",
      "layout": "onedir",
      "artifact": "fcstm-gui-linux-x86_64",
      "product": "products/Linux-onedir.zip",
      "product_sha256": "d9d37e9012122e2a0dc99ce35dc7a1dca5ce5797d6e03b2328cbb54e6a104aa8",
      "acceptance_report_path": "reports/Linux/onedir/report.json",
      "acceptance_report_sha256": "f24db1baeb1c1b178d64679dcf30fda242d1fefc086c5ecc65f7b264646ab4cd",
      "image_path": "images/Linux/onedir/item-26-graph-refresh-1280x720.png",
      "image_sha256": "a495ac71b3c217a534a25df4509c4473ccfc08ae410797a96bc36f22ef8763e0",
      "viewport": "1280x720",
      "scale": "1.5",
      "acceptance_item": "graph.refresh",
      "overlap_exemption_join_keys": [],
      "text_visible": true,
      "hit_test_passed": true,
      "click_passed": true,
      "focus_passed": true,
      "accessible_name_passed": true,
      "business_fact_passed": true,
      "artifact_fact_passed": true,
      "status": "passed",
      "notes": "Fresh release screenshot manually reviewed against visible content, hit target, focus, accessible name, business result, and artifact evidence."
    },
    {
      "join_key": "Linux|onedir|1280x720|1.5|simulation.initialize|images/Linux/onedir/item-31-simulation-initialize-1280x720.png",
      "platform": "Linux",
      "qt_platform": "xcb",
      "layout": "onedir",
      "artifact": "fcstm-gui-linux-x86_64",
      "product": "products/Linux-onedir.zip",
      "product_sha256": "d9d37e9012122e2a0dc99ce35dc7a1dca5ce5797d6e03b2328cbb54e6a104aa8",
      "acceptance_report_path": "reports/Linux/onedir/report.json",